{
  "schema_version": "1",
  "project_id": "sample-project",
  "workflow_id": "assisted-development",
  "nodes": [
    {
      "id": "prepare",
      "kind": "plan",
      "depends_on": []
    },
    {
      "id": "change",
      "kind": "implement",
      "depends_on": [
        "prepare"
      ]
    },
    {
      "id": "checks",
      "kind": "validate",
      "depends_on": [
        "change"
      ]
    },
    {
      "id": "assessment",
      "kind": "review",
      "depends_on": [
        "checks"
      ]
    },
    {
      "id": "accept",
      "kind": "integrate",
      "depends_on": [
        "assessment"
      ]
    }
  ]
}
